Target language lemma,ID,User language gloss,English gloss,POS,Level,Word source,Ex. ID,Form,Analysis,Target language example sentence,User language translation,English translation,Reference,Topic(s),Lesson,
трамвай,943,tram,,N.Masc.Inan,A1,"MiP, МН",1,трамвай,Acc.Sing,Он сел в трамвай и поехал домой.,He got on the tram and went home.,,_,путешествие,21,
трамвай,944,tram,,N.Masc.Inan,A1,"MiP, МН",2,трамвая,Gen.Sing,Я хочу стать водителем трамвая.,I want to become a tram driver.,,_,путешествие,21,
трамвай,945,tram,,N.Masc.Inan,A1,"MiP, МН",3,трамваи,Nom.Plur,Слишком поздно. Трамваи не ходят.,It's too late. The trams aren't running.,,_,путешествие,21,
килограмм,946,kilogram,,N.Masc.Inan,A1,"Golosa, MiP, LM, МН",1,килограмма,Gen.Sing,Я купила два килограмма яблок.,I bought two kilos of apples.,,_,мера,23,
килограмм,947,kilogram,,N.Masc.Inan,A1,"Golosa, MiP, LM, МН",2,килограмм,Nom.Sing,Килограмм брокколи стоит сто рублей.,A kilogram of broccoli costs one hundred rubles.,,_,мера,23,
килограмм,948,kilogram,,N.Masc.Inan,A1,"Golosa, MiP, LM, МН",3,килограммов,Gen.Plur,Мой рюкзак весит восемь килограммов.,My backpack weights eight kilograms.,,_,мера,23,
активный,949,active,,A,A1,МН,1,активных,Gen.Plur,Эта работа подходит для активных людей.,This work is suitable for active people.,,_,"люди, описание",29,
активный,950,active,,A,A1,МН,2,активную,Acc.Fem.Sing,Аудитория играет активную роль в жизни артиста.,The audience plays an active role in a performer's life.,,_,"люди, описание",29,
активный,951,active,,A,A1,МН,3,активной,Gen.Fem.Sing,Маша устала от активной жизни.,Masha got tired of her active life.,,_,"люди, описание",29,
парк,952,park,,N.Masc.Inan,A1,"LM, МН",1,парке,Loc.Sing,Моя мама любит гулять в парке вечером.,My mother likes walking in the park in the evening.,,_,свободное время,1,
парк,953,park,,N.Masc.Inan,A1,"LM, МН",2,парк,Acc.Sing,После школы девочки пошли в парк.,After school the girls went to the park.,,_,свободное время,1,
парк,954,park,,N.Masc.Inan,A1,"LM, МН",3,парка,Gen.Sing,Фестиваль чая пройдёт на территории Парка Горького.,The Tea Festival will take place on the grounds of Gorky Park.,,_,свободное время,1,
бизнесмен,955,businessman,,N.Masc.Anim,A1,"Golosa, MiP, LM, МН, Поехали",1,бизнесменов,Gen.Plur,Новый закон защищает интересы бизнесменов.,The new law protects the interests of businessmen.,,_,"люди, учёба/работа",,
бизнесмен,956,businessman,,N.Masc.Anim,A1,"Golosa, MiP, LM, МН, Поехали",2,бизнесмен,Nom.Sing,Бизнесмен должен быть честным.,A businessman has to be honest.,,_,"люди, учёба/работа",,
бизнесмен,957,businessman,,N.Masc.Anim,A1,"Golosa, MiP, LM, МН, Поехали",3,бизнесмены,Nom.Plur,Российские бизнесмены протестуют против повышения налогов.,Russian businessmen are protesting against a tax increase.,,_,"люди, учёба/работа",,
музей,958,museum,,N.Masc.Inan,A1,"Golosa, MiP, LM, МН",1,музея,Gen.Sing,Работники музея могут посещать выставки бесплатно.,The museum workers can go to the exhibitions for free.,,_,свободное время,3,
музей,959,museum,,N.Masc.Inan,A1,"Golosa, MiP, LM, МН",2,музее,Loc.Sing,В этом музее есть скелет синего кита.,There is a skeleton of a blue whale in this museum.,,_,свободное время,3,
музей,960,museum,,N.Masc.Inan,A1,"Golosa, MiP, LM, МН",3,музей,Nom.Sing,Музей Москвы был открыт в девятнадцатом веке.,The Moscow Museum opened in the nineteenth century.,,_,свободное время,3,
богатый,961,rich,,A,A1,"LM, МН",1,богатый,Nom.Masc.Sing,"Саша – богатый человек, но скромный.",Sasha is a rich man but a modest one.,,_,"люди, мера",21,
богатый,962,rich,,A,A1,"LM, МН",2,богатых,Gen.Plur,Жизнь в центре города – удовольствие только для богатых людей.,Living in the city center is a luxury for rich people only.,,_,"люди, мера",21,
богатый,963,rich,,A,A1,"LM, МН",3,богатым,Ins.Masc.Sing,Я совсем не хочу быть богатым.,I don't want to be rich at all.,,_,"люди, мера",21,
экзамен,964,exam,,N.Masc.Inan,A1,"LM, МН",1,экзамен,Acc.Sing,Эта группа не сдаст экзамен по химии.,This group won't pass the chemistry exam.,,_,учёба/работа,22,
экзамен,965,exam,,N.Masc.Inan,A1,"LM, МН",2,экзамены,Acc.Plur,Летом мы сдаём экзамены по всем предметам.,In summer we have exams in all subjects. ,,_,учёба/работа,22,
экзамен,966,exam,,N.Masc.Inan,A1,"LM, МН",3,экзаменов,Gen.Plur,После экзаменов я собираюсь спать три дня.,After the exams I am going to sleep for three days.,,_,учёба/работа,22,
масло,967,butter,,N.Neut.Inan,A1,"Golosa, MiP, LM, МН",1,маслом,Ins.Sing,Он всегда ест хлеб с маслом на завтрак.,He always has bread and butter for breakfast.,,_,еда,31,
масло,968,oil,,N.Neut.Inan,A1,"Golosa, MiP, LM, МН",2,масла,Gen.Sing,Нужно добавить в салат больше оливкового масла.,You need to add more olive oil to the salad.,,_,еда,31,
масло,969,butter,,N.Neut.Inan,A1,"Golosa, MiP, LM, МН",3,масло,Nom.Sing,"Дома закончилось сливочное масло, нужно купить."," There’s no more butter in the house, we need to buy some.",,_,еда,31,
немец,970,German,,N.Masc.Anim,A1,"LM, МН, Кс",1,немцы,Nom.Plur,Немцы любят пиво.,Gemans like beer.,,_,"люди, политика",25,
немец,971,German,,N.Masc.Anim,A1,"LM, МН, Кс",2,немцев,Gen.Plur,В моём университете много немцев.,There are many Germans at my university.,,_,"люди, политика",25,
немец,972,German,,N.Masc.Anim,A1,"LM, МН, Кс",3,немец,Nom.Sing,"В его анекдотах всегда есть русский, француз и немец.","His jokes are always about a Russian, a Frenchman and a German.",,_,"люди, политика",25,
ложка,973,spoon,,N.Fem.Inan,A1,МН,1,ложку,Acc.Sing,Я кладу в чай одну ложку сахара.,I put a spoonful of sugar in my tea.,,_,"еда, жильё",20,
ложка,974,spoon,,N.Fem.Inan,A1,МН,2,ложкой,Ins.Sing,Маленький мальчик ест суп большой ложкой.,The little boy eats soup with a big spoon.,,_,"еда, жильё",20,
ложка,975,spoon,,N.Fem.Inan,A1,МН,3,ложки,Gen.Sing,Здесь нет ложки.,There is no spoon.,,The Matrix (1999),"еда, жильё",20,
левый,976,left,,A,A1,"MiP, МН",1,левую,Acc.Fem.Sing,Он положил левую руку мне на плечо.,He put his left hand on my shoulder.,,_,"люди, описание",19,
левый,977,left,,N.Masc.Anim,A1,"MiP, МН",2,левые,Nom.Plur,Левые не получают поддержки от правительства Российской Федерации.,Leftists don't get support from the government of the Russian Federation.,,_,политика,19,
левый,978,left,,A,A1,"MiP, МН",3,левой,Gen.Fem.Sing,Маша сломала палец левой руки.,Masha broke her finger on her left hand.,,_,"люди, описание",19,
комедия,979,comedy,,N.Fem.Inan,A1,"MiP, LM, МН",1,комедия,Nom.Sing,"Это комедия, в ней никто не умирает.","This is a comedy, so nobody dies.",,_,свободное время,10,
комедия,980,comedy,,N.Fem.Inan,A1,"MiP, LM, МН",2,комедии,Gen.Sing,Я читал это в комедии Шекспира.,I read it in a comedy by Shakespeare.,,_,свободное время,10,
комедия,981,comedy,,N.Fem.Inan,A1,"MiP, LM, МН",3,комедию,Acc.Sing,Я останусь дома и посмотрю хорошую комедию.,I’ll stay at home and watch a good comedy.,,_,свободное время,10,
понравиться,982,please,,V,A1,"LM, МН",1,понравилось,Perf.Neut.Sing.Past,Мне понравилось это вино.,I really liked this wine.,,_,внутренний мир,28,
понравиться,983,please,,V,A1,"LM, МН",2,понравился,Perf.Masc.Sing.Past,Моему брату не понравился мой новый друг.,My brother didn't like my new friend.,,_,внутренний мир,28,
понравиться,984,please,,V,A1,"LM, МН",3,понравилась,Perf.Fem.Sing.Past,София сразу мне понравилась.,I liked Sophia at once.,,_,внутренний мир,28,
футбол,985,soccer,,N.Masc.Inan,A1,"Golosa, MiP, LM, МН",1,футбол,Acc.Sing,На перемене мы обычно играем в футбол или пинг-понг.,During the break we always play soccer or ping-pong.,,_,свободное время,9,
футбол,986,soccer,,N.Masc.Inan,A1,"Golosa, MiP, LM, МН",2,футбола,Gen.Sing,Никакого футбола в моём дворе!,No soccer in my yard!,,_,свободное время,9,
футбол,987,soccer,,N.Masc.Inan,A1,"Golosa, MiP, LM, МН",3,футболу,Dat.Sing,В 2018 чемпионат мира по футболу прошёл в России.,In 2018 the World Cup was held in Russia.,,_,свободное время,9,
пообедать,988,eat lunch,,V,A1,"Golosa, MiP, LM, МН",1,пообедали,Perf.Plur.Past,Мы пообедали в новом кафе.,We ate lunch in the new café.,,_,еда,29,
пообедать,989,eat lunch,,V,A1,"Golosa, MiP, LM, МН",2,пообедать,Perf.Inf,После работы мы решили вместе пообедать.,After work we decided to eat lunch together.,,_,еда,29,
пообедать,990,eat lunch,,V,A1,"Golosa, MiP, LM, МН",3,пообедаем,Perf.Plur.1,"Мы с Марией пообедаем вместе, а потом пойдём в кино.",Maria and I are going to eat lunch and then go to the movie theater.,,_,еда,29,
салат,991,lettuce,,N.Masc.Inan,A1,"Golosa, MiP, LM, МН",1,салата,Gen.Sing,"Например, ты можешь положить в сэндвич лист салата.","For example, you can put a lettuce leaf in the sandwich.",,_,еда,8,
салат,992,salad,,N.Masc.Inan,A1,"Golosa, MiP, LM, МН",2,салат,Acc.Sing,Папа сегодня готовит свой любимый салат.,Today Dad is making his favorite salad.,,_,еда,8,
салат,993,salad,,N.Masc.Inan,A1,"Golosa, MiP, LM, МН",3,салатов,Gen.Plur,На Новый Год люди обычно готовят пять или шесть разных салатов.,For the New Year celebration people usually prepare five or six different salads. ,,_,еда,8,
стадион,994,stadium,,N.Masc.Inan,A1,"Golosa, MiP, LM, МН",1,стадиона,Gen.Sing,Друзья будут ждать меня у стадиона.,My friends will wait for me outside the stadium.,,_,свободное время,5,
стадион,995,stadium,,N.Masc.Inan,A1,"Golosa, MiP, LM, МН",2,стадионе,Loc.Sing,"На стадионе ""Лужники"" пройдёт следующий матч чемпионата мира.",The next World Cup will be held at the Luzhniki stadium.,,_,свободное время,5,
стадион,996,stadium,,N.Masc.Inan,A1,"Golosa, MiP, LM, МН",3,стадион,Nom.Sing,Стадион был построен в 2014 году.,The stadium was built in 2014.,,_,свободное время,5,
ключ,997,key,,N.Masc.Inan,A1,"MiP, LM, МН",1,ключ,Acc.Sing,Я ушла и заперла дверь на ключ.,I left and locked the door with the key.,,_,жильё ,27,
ключ,998,key,,N.Masc.Inan,A1,"MiP, LM, МН",2,ключи,Acc.Plur,"Кажется, я забыл ключи.",It seems I forgot the keys.,,_,жильё ,27,
ключ,999,key,,N.Masc.Inan,A1,"MiP, LM, МН",3,ключом,Ins.Sing,Мама откроет дверь своим ключом.,Mom will open the door with her key.,,_,жильё ,27,
яйцо,1000,egg,,N.Neut.Inan,A1,"Golosa, MiP, МН",1,яиц,Gen.Plur,Я купила десяток яиц.,I bought ten eggs.,,_,еда,23,
яйцо,1001,egg,,N.Neut.Inan,A1,"Golosa, MiP, МН",2,яйца,Acc.Plur,Папа достал из холодильника яйца и помидоры.,Dad took eggs and tomatoes out of the refrigerator.,,_,еда,23,
яйцо,1002,egg,,N.Neut.Inan,A1,"Golosa, MiP, МН",3,яйцо,Acc.Sing,На завтрак я съел яйцо.,For breakfast I ate an egg.,,_,еда,23,
марка,1003,brand,,N.Fem.Inan,A1,"LM, МН",1,марки,Gen.Sing,Я не покупаю одежду этой марки.,I don't buy this brand of clothes.,,_,магазин,,
марка,1004,stamp,,N.Fem.Inan,A1,"LM, МН",2,марок,Gen.Plur,У меня большая коллекция марок.,I have a big stamp collection.,,_,общение,27,
марка,1005,brand,,N.Fem.Inan,A1,"LM, МН",3,марку,Acc.Sing,Моя сестра предпочитает другую марку пива.,My sister prefers another brand of beer.,,_,магазин,,
попросить,1006,ask for,,V,A1,"LM, МН",1,попросил,Perf.Masc.Sing.Past,Брат попросил у меня деньги на обед.,My brother asked me for money to buy lunch.,,_,"люди, общение",28,
попросить,1007,ask for,,V,A1,"LM, МН",2,попросить,Perf.Inf,Я хотела попросить у него денег.,I wanted to ask him for money.,,_,"люди, общение",28,
попросить,1008,ask for,,V,A1,"LM, МН",3,попросила,Perf.Fem.Sing.Past,"Саша, мама попросила тебя помыть посуду.","Sasha, Mom asked you to wash the dishes.",,_,"люди, общение",28,
цирк,1009,circus,,N.Masc.Inan,A1,"Golosa, MiP, LM, МН",1,цирка,Gen.Sing,Я хочу взять интервью у артиста цирка.,I want to interview a circus performer.,,_,свободное время,5,
цирк,1010,circus,,N.Masc.Inan,A1,"Golosa, MiP, LM, МН",2,цирке,Loc.Sing,"Работа в цирке тяжёлая, но интересная.",Working in the circus is hard but interesting,,_,свободное время,5,
цирк,1011,circus,,N.Masc.Inan,A1,"Golosa, MiP, LM, МН",3,цирк,Nom.Sing,Этот цирк великолепен!,This circus is incredible!,,_,свободное время,5,
обед,1012,lunch,,N.Masc.Inan,A1,"Golosa, MiP, LM, МН",1,обеда,Gen.Sing,После обеда я всегда хочу спать.,After lunch I always want to sleep.,,_,еда,8,
обед,1013,lunch,,N.Masc.Inan,A1,"Golosa, MiP, LM, МН",2,обед,Nom.Sing,Обед начинается в два часа.,Lunch starts at two o'clock.,,_,еда,8,
обед,1014,lunch,,N.Masc.Inan,A1,"Golosa, MiP, LM, МН",3,обеду,Dat.Sing,"Думаю, мы вернёмся к обеду.",I think we're going to come back before lunch.,,_,еда,8,
грамм,1015,gram,,N.Masc.Inan,A1,"Golosa, MiP, МН",1,грамм,Gen.Plur,Я положила в торт двести грамм сахара.,I put 200g of sugar in the cake.,,_,мера,23,
грамм,1016,gram,,N.Masc.Inan,A1,"Golosa, MiP, МН",2,граммов,Gen.Plur,Каждый из нас выпил сто граммов водки.,Each of us drank 100 grams of vodka.,,_,мера,23,
грамм,1017,gram,,N.Masc.Inan,A1,"Golosa, MiP, МН",3,грамма,Gen.Sing,Вес золотой медали Олимпийских игр — пятьсот шестьдесят два грамма. ,The Olympic gold medal weighs 562 grams.,,_,мера,23,
гостиница,1018,hotel,,N.Fem.Inan,A1,"MiP, LM, МН",1,гостинице,Loc.Sing,Мы остановимся в гостинице на площади Восстания.,We are staying in the hotel on Vosstaniya Square.,,_,"путешествие, жильё",16,
гостиница,1019,hotel,,N.Fem.Inan,A1,"MiP, LM, МН",2,гостиница,Nom.Sing,Наша гостиница была ужасна.,Our hotel was terrible.,,_,"путешествие, жильё",16,
гостиница,1020,hotel,,N.Fem.Inan,A1,"MiP, LM, МН",3,гостиницы,Gen.Sing,Мы выезжаем из гостиницы в восемь утра.,We're leaving the hotel at 8 in the morning.,,_,"путешествие, жильё",16,
нож,1021,knife,,N.Masc.Inan,A1,МН,1,ножом,Ins.Sing,Он всегда ходит с ножом.,He always carries a knife.,,_,жильё,28,
нож,1022,knife,,N.Masc.Inan,A1,МН,2,нож,Acc.Sing,Я не могу найти нож.,I can't find a knife.,,_,жильё,28,
нож,1023,knife,,N.Masc.Inan,A1,МН,3,ножи,Acc.Plur,Мы купили новые ножи на кухню.,We bought new kitchen knives.,,_,жильё,28,
спорт,1024,sport,,N.Masc.Inan,A1,"Golosa, MiP, МН",1,спорта,Gen.Sing,Мой старший брат – мастер спорта по боксу.,My big brother is a master of sports in boxing.,,_,свободное время,9,
спорт,1025,sport,,N.Masc.Inan,A1,"Golosa, MiP, МН",2,спортом,Ins.Sing,Заниматься спортом полезно для здоровья.,Playing sports is good for one's health.,,_,свободное время,9,
спорт,1026,sport,,N.Masc.Inan,A1,"Golosa, MiP, МН",3,спорте,Loc.Sing,Я ничего не понимаю в спорте.,I don't understand anything about sports.,,_,свободное время,9,
рубашка,1027,shirt,,N.Fem.Inan,A1,"Golosa, MiP, МН, Кс",1,рубашка,Nom.Sing,Какая у тебя красивая рубашка!,What a lovely shirt you have!,,_,люди,27,
рубашка,1028,shirt,,N.Fem.Inan,A1,"Golosa, MiP, МН, Кс",2,рубашку,Acc.Sing,"Было жарко, и я снял рубашку.","It was hot, so I took off my shirt.",,_,люди,27,
рубашка,1029,shirt,,N.Fem.Inan,A1,"Golosa, MiP, МН, Кс",3,рубашки,Gen.Sing,Машенька положила конфету в карман рубашки.,Mashenka put a candy in her shirt pocket.,,_,люди,27,
медицина,1030,medicine,,N.Fem.Inan,A1,"Golosa, MiP, МН",1,медицине,Loc.Sing,Эту технологию используют в медицине.,This technology is used in medicine.,,_,здоровье,28,
медицина,1031,medicine,,N.Fem.Inan,A1,"Golosa, MiP, МН",2,медицина,Nom.Sing,Медицина в России — бесплатная.,Medical care in Russia is free of charge.,,_,здоровье,28,
медицина,1032,medicine,,N.Fem.Inan,A1,"Golosa, MiP, МН",3,медицины,Gen.Sing,Развитие медицины — важная задача.,The development of medicine is an important task.,,_,здоровье,28,
остановка,1033,stop,,N.Fem.Inan,A1,"MiP, LM, МН",1,остановка,Nom.Sing,Следующая остановка — «площадь Восстания».,"The next stop is ""Vosstaniya square"".",,_,"транспорт, путешествие",19,
остановка,1034,stop,,N.Fem.Inan,A1,"MiP, LM, МН",2,остановке,Loc.Sing,Приходи! Я жду тебя на остановке.,Come! I’m waiting for you at the bus stop.,,_,"транспорт, путешествие",19,
остановка,1035,stop,,N.Fem.Inan,A1,"MiP, LM, МН",3,остановок,Gen.Plur,Через пять остановок я вышел из автобуса.,I got off the bus after 5 stops.,,_,"транспорт, путешествие",19,
немецкий,1036,German,,A,A1,"Golosa, MiP, LM, МН",1,немецких,Gen.Plur,В Москве много немецких туристов.,There are a lot of German tourists in Moscow.,,_,"политика, описание, люди",11,
немецкий,1037,German,,A,A1,"Golosa, MiP, LM, МН",2,немецкого,Gen.Masc.Sing,Маша — преподаватель немецкого языка.,Masha is a German teacher.,,_,"политика, описание, люди",11,
немецкий,1038,German,,A,A1,"Golosa, MiP, LM, МН",3,немецкий,Inan.Acc.Masc.Sing,"Я учил немецкий в школе, но уже ничего не помню.",I learned German at school but now I don’t remember anything.,,_,"политика, описание, люди",11,
зелёный,1039,green,,A,A1,"LM, МН",1,зелёный,Nom.Masc.Sing,Мне нравится зелёный чай с мятой.,I like green tea with mint.,,_,описание,7,
зелёный,1040,green,,A,A1,"LM, МН",2,зелёные,Nom.Plur,У Оли зелёные глаза и чёрные волосы.,Olya has green eyes and black hair.,,_,описание,7,
зелёный,1041,green,,A,A1,"LM, МН",3,зелёной,Gen.Fem.Sing,Купи зелёной краски! Мы красим стены в доме.,Buy some green paint! We’re painting the walls in our house.,,_,описание,7,
учительница,1042,teacher,,N.Fem.Anim,A1,"Golosa, MiP, LM, МН",1,учительницы,Gen.Sing,День рождения нашей учительницы — в апреле.,Our teacher’s birthday is in April.,,_,"учёба/работа, люди",5,
учительница,1043,teacher,,N.Fem.Anim,A1,"Golosa, MiP, LM, МН",2,учительница,Nom.Sing,"Наша учительница строгая, но справедливая.",Our teacher is strict but fair.,,_,"учёба/работа, люди",5,
учительница,1044,teacher,,N.Fem.Anim,A1,"Golosa, MiP, LM, МН",3,учительнице,Dat.Sing,"Вчера я позвонил учительнице, потому что не пришёл на урок.",I called my teacher yesterday because I didn’t go to class.,,_,"учёба/работа, люди",5,
родной,1045,native,,A,A1,"LM, МН",1,родной,Nom.Masc.Sing,Какой у вас родной язык?,What is your mother tongue?,,_,"люди, политика",15,
родной,1046,native,,A,A1,"LM, МН",2,родном,Loc.Masc.Sing,Мне всегда уютно в моём родном городе.,I always feel comfortable in my hometown.,,_,"люди, политика",15,
родной,1047,native,,A,A1,"LM, МН",3,родным,Ins.Masc.Sing,Ты как с родным отцом разговариваешь?,Is that any way to speak to your own father?,,_,"люди, политика",15,
транспорт,1048,transport,,N.Masc.Inan,A1,МН,1,транспорта,Gen.Sing,Каким видом транспорта вы пользуетесь?,Which means of transport do you use?,,_,"транспорт, путешествие",21,
транспорт,1049,transport,,N.Masc.Inan,A1,МН,2,транспортом,Ins.Sing,Я не пользуюсь общественным транспортом — у меня своя машина.,I don’t use public transport — I have my own car.,,_,"транспорт, путешествие",21,
транспорт,1050,transport,,N.Masc.Inan,A1,МН,3,транспорт,Acc.Sing,Важно развивать общественный транспорт.,It’s important to develop public transport.,,_,"транспорт, путешествие",21,
посмотреть,1051,watch,,V,A1,"Golosa, MiP, LM, МН",1,посмотреть,Perf.Inf,Какой красивый браслет! Можно посмотреть?,What a beautiful bracelet! Can I take a look?,,_,"свободное время, общение",22,
посмотреть,1052,watch,,V,A1,"Golosa, MiP, LM, МН",2,посмотрел,Perf.Masc.Sing.Past,"Ты посмотрел, как пройти в центр города?",Did you check how to get to the city center?,,_,"свободное время, общение",22,
посмотреть,1053,watch,,V,A1,"Golosa, MiP, LM, МН",3,посмотрела,Perf.Fem.Sing.Past,Она странно посмотрела на меня.,She gave me a strange look.,,_,"свободное время, общение",22,
вход,1054,entrance,,N.Masc.Inan,A1,"MiP, LM, МН",1,входа,Gen.Sing,Жди меня у входа в магазин!,Wait for me at the entrance to the store!,,_,жильё,16,
вход,1055,entrance,,N.Masc.Inan,A1,"MiP, LM, МН",2,входе,Loc.Sing,На входе в аэропорт теперь стоит охрана.,There is now security at the entrance to the airport.,,_,жильё,16,
вход,1056,entrance,,N.Masc.Inan,A1,"MiP, LM, МН",3,вход,Acc.Sing,Я не вижу вход в этот магазин.,I can’t see the entrance to this shop.,,_,жильё,16,
